<?xml version="1.0" encoding="UTF-8" ?>
<!DOCTYPE listado [
<!ELEMENT listado (persona+)>
<!ELEMENT persona (nombre,email,direccion,telefono,codigo_postal,proximo_destino,pais)>
<!ELEMENT nombre (#PCDATA)>
<!ELEMENT email (#PCDATA)>
<!ELEMENT direccion (#PCDATA)>
<!ELEMENT telefono (#PCDATA)>
<!ELEMENT codigo_postal (#PCDATA)>
<!ELEMENT proximo_destino (#PCDATA)>
<!ELEMENT pais (#PCDATA)>
]>




<listado>
	<persona>
		<nombre>Peter Rogers</nombre>
		<email>dolor.elit@google.ca</email>
		<direccion>P.O. Box 810, 3393 Feugiat. Road</direccion>
		<telefono>01 18 63 43 43</telefono>
		<codigo_postal>2221</codigo_postal>
		<proximo_destino>Jalisco</proximo_destino>
		<pais>New Zealand</pais>
	</persona>
	<persona>
		<nombre>Uriel Grant</nombre>
		<email>amet.ornare.lectus@outlook.net</email>
		<direccion>216-2164 Pellentesque Street</direccion>
		<telefono>09 70 65 82 87</telefono>
		<codigo_postal>43630</codigo_postal>
		<proximo_destino>Valle del Cauca</proximo_destino>
		<pais>France</pais>
	</persona>
	<persona>
		<nombre>Howard Rosario</nombre>
		<email>risus@yahoo.ca</email>
		<direccion>P.O. Box 314, 9266 Iaculis Rd.</direccion>
		<telefono>08 52 88 25 48</telefono>
		<codigo_postal>2344</codigo_postal>
		<proximo_destino>Mississippi</proximo_destino>
		<pais>Indonesia</pais>
	</persona>
	<persona>
		<nombre>Maite Finley</nombre>
		<email>erat.in@hotmail.org</email>
		<direccion>Ap #408-5436 Mus. Street</direccion>
		<telefono>09 56 71 70 17</telefono>
		<codigo_postal>44684</codigo_postal>
		<proximo_destino>zmir</proximo_destino>
		<pais>Australia</pais>
	</persona>
	<persona>
		<nombre>Raven Mooney</nombre>
		<email>rhoncus@protonmail.org</email>
		<direccion>2824 Imperdiet St.</direccion>
		<telefono>08 35 17 73 33</telefono>
		<codigo_postal>680822</codigo_postal>
		<proximo_destino>Canarias</proximo_destino>
		<pais>Canada</pais>
	</persona>
	<persona>
		<nombre>Orson Sellers</nombre>
		<email>consectetuer.adipiscing@aol.ca</email>
		<direccion>P.O. Box 685, 804 Et, Rd.</direccion>
		<telefono>05 76 61 31 31</telefono>
		<codigo_postal>5503</codigo_postal>
		<proximo_destino>British Columbia</proximo_destino>
		<pais>Nigeria</pais>
	</persona>
	<persona>
		<nombre>Katelyn Stafford</nombre>
		<email>curabitur.sed.tortor@outlook.ca</email>
		<direccion>445-8019 Phasellus St.</direccion>
		<telefono>04 18 61 92 81</telefono>
		<codigo_postal>141640</codigo_postal>
		<proximo_destino>Ulster</proximo_destino>
		<pais>France</pais>
	</persona>
	<persona>
		<nombre>Cooper Mccarthy</nombre>
		<email>massa@aol.ca</email>
		<direccion>Ap #199-6739 Vel, Street</direccion>
		<telefono>09 12 86 84 66</telefono>
		<codigo_postal>24629-73617</codigo_postal>
		<proximo_destino>Sonora</proximo_destino>
		<pais>India</pais>
	</persona>
	<persona>
		<nombre>Lawrence O'brien</nombre>
		<email>vitae.aliquet@aol.edu</email>
		<direccion>Ap #438-3663 Risus. Rd.</direccion>
		<telefono>03 86 42 49 13</telefono>
		<codigo_postal>54-507</codigo_postal>
		<proximo_destino>Bremen</proximo_destino>
		<pais>Vietnam</pais>
	</persona>
	<persona>
		<nombre>Glenna Barber</nombre>
		<email>duis@icloud.com</email>
		<direccion>P.O. Box 335, 6894 Gravida. Street</direccion>
		<telefono>03 16 62 73 53</telefono>
		<codigo_postal>7991</codigo_postal>
		<proximo_destino>Puno</proximo_destino>
		<pais>Germany</pais>
	</persona>
	<persona>
		<nombre>Dara Espinoza</nombre>
		<email>est.mauris.rhoncus@hotmail.edu</email>
		<direccion>Ap #866-3756 Est Ave</direccion>
		<telefono>04 82 34 19 77</telefono>
		<codigo_postal>441161</codigo_postal>
		<proximo_destino>Utrecht</proximo_destino>
		<pais>India</pais>
	</persona>
	<persona>
		<nombre>Timothy Larsen</nombre>
		<email>vel.sapien@protonmail.couk</email>
		<direccion>Ap #261-7461 Ipsum St.</direccion>
		<telefono>05 17 26 60 29</telefono>
		<codigo_postal>432827</codigo_postal>
		<proximo_destino>Limburg</proximo_destino>
		<pais>Ireland</pais>
	</persona>
	<persona>
		<nombre>Fritz Foster</nombre>
		<email>dolor.nonummy@outlook.couk</email>
		<direccion>591-5661 Lorem St.</direccion>
		<telefono>01 03 32 03 76</telefono>
		<codigo_postal>66858</codigo_postal>
		<proximo_destino>Vestland</proximo_destino>
		<pais>China</pais>
	</persona>
	<persona>
		<nombre>Zachery Palmer</nombre>
		<email>libero@yahoo.ca</email>
		<direccion>945-3207 Tincidunt St.</direccion>
		<telefono>05 05 05 45 34</telefono>
		<codigo_postal>2011 NH</codigo_postal>
		<proximo_destino>Araucanía</proximo_destino>
		<pais>Russian Federation</pais>
	</persona>
	<persona>
		<nombre>Valentine Delgado</nombre>
		<email>mi@yahoo.org</email>
		<direccion>4928 Metus Avenue</direccion>
		<telefono>02 62 67 81 86</telefono>
		<codigo_postal>57438</codigo_postal>
		<proximo_destino>Agder</proximo_destino>
		<pais>United Kingdom</pais>
	</persona>
	<persona>
		<nombre>Austin Macias</nombre>
		<email>at.sem@protonmail.net</email>
		<direccion>160-7222 Ultricies Av.</direccion>
		<telefono>09 11 31 63 65</telefono>
		<codigo_postal>35766</codigo_postal>
		<proximo_destino>Vorarlberg</proximo_destino>
		<pais>Turkey</pais>
	</persona>
	<persona>
		<nombre>Oscar Craig</nombre>
		<email>arcu@yahoo.couk</email>
		<direccion>P.O. Box 593, 385 Consectetuer, St.</direccion>
		<telefono>06 39 12 55 79</telefono>
		<codigo_postal>23564</codigo_postal>
		<proximo_destino>South Kalimantan</proximo_destino>
		<pais>Mexico</pais>
	</persona>
	<persona>
		<nombre>Nolan Hammond</nombre>
		<email>nam.nulla@aol.org</email>
		<direccion>P.O. Box 446, 9911 Turpis Avenue</direccion>
		<telefono>01 27 89 37 74</telefono>
		<codigo_postal>55164</codigo_postal>
		<proximo_destino>Bắc Ninh</proximo_destino>
		<pais>Nigeria</pais>
	</persona>
	<persona>
		<nombre>Lois Mills</nombre>
		<email>eleifend.nec@icloud.edu</email>
		<direccion>587-2605 Nec Road</direccion>
		<telefono>05 37 83 72 62</telefono>
		<codigo_postal>N1K 8N7</codigo_postal>
		<proximo_destino>łódzkie</proximo_destino>
		<pais>Canada</pais>
	</persona>
	<persona>
		<nombre>Ivan Coleman</nombre>
		<email>malesuada.vel.venenatis@google.edu</email>
		<direccion>Ap #673-3251 Fringilla Ave</direccion>
		<telefono>06 37 37 29 64</telefono>
		<codigo_postal>G9 8PY</codigo_postal>
		<proximo_destino>South Jeolla</proximo_destino>
		<pais>Indonesia</pais>
	</persona>
	<persona>
		<nombre>Rudyard Holmes</nombre>
		<email>urna@outlook.ca</email>
		<direccion>176-5612 Non Street</direccion>
		<telefono>02 85 76 02 86</telefono>
		<codigo_postal>84550</codigo_postal>
		<proximo_destino>Kon Tum</proximo_destino>
		<pais>China</pais>
	</persona>
	<persona>
		<nombre>Armand Lang</nombre>
		<email>libero.at@yahoo.net</email>
		<direccion>P.O. Box 739, 4108 Lacinia Ave</direccion>
		<telefono>09 60 37 25 93</telefono>
		<codigo_postal>91287-03482</codigo_postal>
		<proximo_destino>West Papua</proximo_destino>
		<pais>Canada</pais>
	</persona>
	<persona>
		<nombre>Quamar Berger</nombre>
		<email>egestas.nunc@hotmail.couk</email>
		<direccion>P.O. Box 385, 4962 Nibh Rd.</direccion>
		<telefono>02 92 56 82 48</telefono>
		<codigo_postal>17885</codigo_postal>
		<proximo_destino>South Island</proximo_destino>
		<pais>United States</pais>
	</persona>
	<persona>
		<nombre>Daquan Gomez</nombre>
		<email>ac@hotmail.edu</email>
		<direccion>4967 Elit. St.</direccion>
		<telefono>07 53 95 54 88</telefono>
		<codigo_postal>617688</codigo_postal>
		<proximo_destino>British Columbia</proximo_destino>
		<pais>Norway</pais>
	</persona>
	<persona>
		<nombre>Nicole Patterson</nombre>
		<email>molestie.tellus.aenean@aol.edu</email>
		<direccion>330-2777 Nullam Ave</direccion>
		<telefono>06 62 46 52 86</telefono>
		<codigo_postal>40113</codigo_postal>
		<proximo_destino>Papua</proximo_destino>
		<pais>Australia</pais>
	</persona>
	<persona>
		<nombre>Christine Bryant</nombre>
		<email>nulla@outlook.edu</email>
		<direccion>Ap #905-5581 Ligula. Ave</direccion>
		<telefono>08 72 67 23 87</telefono>
		<codigo_postal>8477</codigo_postal>
		<proximo_destino>North Island</proximo_destino>
		<pais>Vietnam</pais>
	</persona>
	<persona>
		<nombre>Keelie Collier</nombre>
		<email>dui.lectus@yahoo.org</email>
		<direccion>177-2852 Metus. St.</direccion>
		<telefono>07 17 76 54 49</telefono>
		<codigo_postal>38271</codigo_postal>
		<proximo_destino>Tyrol</proximo_destino>
		<pais>United States</pais>
	</persona>
	<persona>
		<nombre>Mari Rodriguez</nombre>
		<email>integer.tincidunt@hotmail.ca</email>
		<direccion>788-1047 Quisque Rd.</direccion>
		<telefono>08 16 75 16 28</telefono>
		<codigo_postal>386698</codigo_postal>
		<proximo_destino>West-Vlaanderen</proximo_destino>
		<pais>Ireland</pais>
	</persona>
	<persona>
		<nombre>Alika Mccarty</nombre>
		<email>fringilla@icloud.couk</email>
		<direccion>556-9966 Proin Street</direccion>
		<telefono>07 30 04 85 96</telefono>
		<codigo_postal>5136 FP</codigo_postal>
		<proximo_destino>Riau Islands</proximo_destino>
		<pais>Colombia</pais>
	</persona>
	<persona>
		<nombre>Jacqueline Hood</nombre>
		<email>nulla.interdum.curabitur@outlook.org</email>
		<direccion>648-714 Nunc Rd.</direccion>
		<telefono>05 51 13 73 18</telefono>
		<codigo_postal>44189</codigo_postal>
		<proximo_destino>Limburg</proximo_destino>
		<pais>Ireland</pais>
	</persona>
	<persona>
		<nombre>Philip Stafford</nombre>
		<email>lorem.fringilla.ornare@protonmail.couk</email>
		<direccion>Ap #305-4329 Non, Ave</direccion>
		<telefono>06 44 31 62 83</telefono>
		<codigo_postal>6650</codigo_postal>
		<proximo_destino>Nagaland</proximo_destino>
		<pais>Poland</pais>
	</persona>
	<persona>
		<nombre>Miranda Richardson</nombre>
		<email>enim.gravida@yahoo.edu</email>
		<direccion>Ap #744-2036 Eu St.</direccion>
		<telefono>06 82 25 81 86</telefono>
		<codigo_postal>646932</codigo_postal>
		<proximo_destino>Los Ríos</proximo_destino>
		<pais>Poland</pais>
	</persona>
	<persona>
		<nombre>Dustin Morse</nombre>
		<email>pede.cras@google.com</email>
		<direccion>Ap #647-7009 Vivamus Rd.</direccion>
		<telefono>08 96 70 44 36</telefono>
		<codigo_postal>11016</codigo_postal>
		<proximo_destino>Gävleborgs län</proximo_destino>
		<pais>Italy</pais>
	</persona>
	<persona>
		<nombre>Eric Cash</nombre>
		<email>mattis.semper@google.com</email>
		<direccion>6490 Ac Av.</direccion>
		<telefono>02 37 15 78 49</telefono>
		<codigo_postal>00548</codigo_postal>
		<proximo_destino>Abruzzo</proximo_destino>
		<pais>New Zealand</pais>
	</persona>
	<persona>
		<nombre>Rhea Merritt</nombre>
		<email>aliquam@google.org</email>
		<direccion>267-6689 Magna. Rd.</direccion>
		<telefono>04 51 84 66 18</telefono>
		<codigo_postal>4140</codigo_postal>
		<proximo_destino>Burgenland</proximo_destino>
		<pais>Germany</pais>
	</persona>
	<persona>
		<nombre>Paki Cole</nombre>
		<email>quam.vel@outlook.ca</email>
		<direccion>Ap #946-1768 Vestibulum Road</direccion>
		<telefono>02 37 54 72 67</telefono>
		<codigo_postal>8707</codigo_postal>
		<proximo_destino>Northamptonshire</proximo_destino>
		<pais>Indonesia</pais>
	</persona>
	<persona>
		<nombre>Quail Mcfadden</nombre>
		<email>et.magnis@google.edu</email>
		<direccion>P.O. Box 925, 9119 Odio. Avenue</direccion>
		<telefono>03 34 37 51 88</telefono>
		<codigo_postal>16122</codigo_postal>
		<proximo_destino>Poitou-Charentes</proximo_destino>
		<pais>Colombia</pais>
	</persona>
	<persona>
		<nombre>Stephanie Floyd</nombre>
		<email>venenatis@google.com</email>
		<direccion>284-8483 Maecenas St.</direccion>
		<telefono>08 96 48 73 35</telefono>
		<codigo_postal>C6M 4R4</codigo_postal>
		<proximo_destino>Magdalena</proximo_destino>
		<pais>France</pais>
	</persona>
	<persona>
		<nombre>Priscilla Cantrell</nombre>
		<email>ac.sem@protonmail.ca</email>
		<direccion>829-7517 Est, Street</direccion>
		<telefono>06 39 66 53 51</telefono>
		<codigo_postal>175645</codigo_postal>
		<proximo_destino>Cusco</proximo_destino>
		<pais>Australia</pais>
	</persona>
	<persona>
		<nombre>Darrel Quinn</nombre>
		<email>lorem.donec@hotmail.net</email>
		<direccion>P.O. Box 425, 5545 At, Avenue</direccion>
		<telefono>02 08 26 83 63</telefono>
		<codigo_postal>418344</codigo_postal>
		<proximo_destino>Huáběi</proximo_destino>
		<pais>Italy</pais>
	</persona>
	<persona>
		<nombre>Fleur Brady</nombre>
		<email>libero.proin@outlook.org</email>
		<direccion>Ap #932-7217 In Rd.</direccion>
		<telefono>05 25 94 63 62</telefono>
		<codigo_postal>8437</codigo_postal>
		<proximo_destino>Stockholms län</proximo_destino>
		<pais>Chile</pais>
	</persona>
	<persona>
		<nombre>Yuli Ortega</nombre>
		<email>rutrum@google.ca</email>
		<direccion>Ap #505-5796 Sed Ave</direccion>
		<telefono>08 31 43 20 77</telefono>
		<codigo_postal>EC5P 3KW</codigo_postal>
		<proximo_destino>Volgograd Oblast</proximo_destino>
		<pais>France</pais>
	</persona>
	<persona>
		<nombre>Wesley Copeland</nombre>
		<email>a.purus@google.edu</email>
		<direccion>287-9703 Felis. Street</direccion>
		<telefono>06 35 76 33 94</telefono>
		<codigo_postal>641267</codigo_postal>
		<proximo_destino>Chhattisgarh</proximo_destino>
		<pais>Netherlands</pais>
	</persona>
	<persona>
		<nombre>Jade Freeman</nombre>
		<email>quam.curabitur@hotmail.net</email>
		<direccion>443-5151 Suspendisse Rd.</direccion>
		<telefono>02 74 20 22 79</telefono>
		<codigo_postal>8622</codigo_postal>
		<proximo_destino>West Java</proximo_destino>
		<pais>Mexico</pais>
	</persona>
	<persona>
		<nombre>Hedwig Haney</nombre>
		<email>rutrum.magna@yahoo.org</email>
		<direccion>1645 Eu Rd.</direccion>
		<telefono>03 46 07 86 35</telefono>
		<codigo_postal>0834 IC</codigo_postal>
		<proximo_destino>Bangka Belitung Islands</proximo_destino>
		<pais>United Kingdom</pais>
	</persona>
	<persona>
		<nombre>Alexander Gordon</nombre>
		<email>ante.nunc.mauris@yahoo.org</email>
		<direccion>1450 Ac Road</direccion>
		<telefono>01 73 48 68 50</telefono>
		<codigo_postal>35944</codigo_postal>
		<proximo_destino>Sachsen</proximo_destino>
		<pais>Belgium</pais>
	</persona>
	<persona>
		<nombre>Aidan Murphy</nombre>
		<email>nascetur.ridiculus@aol.edu</email>
		<direccion>347 Ante Av.</direccion>
		<telefono>07 45 61 63 88</telefono>
		<codigo_postal>85221-966</codigo_postal>
		<proximo_destino>Dalarnas län</proximo_destino>
		<pais>Costa Rica</pais>
	</persona>
	<persona>
		<nombre>Malcolm Thompson</nombre>
		<email>nec@protonmail.edu</email>
		<direccion>829-1607 Iaculis Road</direccion>
		<telefono>05 80 86 17 47</telefono>
		<codigo_postal>86713</codigo_postal>
		<proximo_destino>Madhya Pradesh</proximo_destino>
		<pais>Sweden</pais>
	</persona>
	<persona>
		<nombre>Morgan Camacho</nombre>
		<email>ac.facilisis@protonmail.org</email>
		<direccion>3532 Fusce St.</direccion>
		<telefono>07 53 48 72 48</telefono>
		<codigo_postal>26215-739</codigo_postal>
		<proximo_destino>Araucanía</proximo_destino>
		<pais>Sweden</pais>
	</persona>
	<persona>
		<nombre>Keiko Barnett</nombre>
		<email>mollis.vitae@icloud.edu</email>
		<direccion>399-800 Vulputate St.</direccion>
		<telefono>02 11 16 95 23</telefono>
		<codigo_postal>7225 VS</codigo_postal>
		<proximo_destino>Quảng Bình</proximo_destino>
		<pais>Canada</pais>
	</persona>
	<persona>
		<nombre>Karleigh Chambers</nombre>
		<email>euismod@hotmail.net</email>
		<direccion>851-1867 Suspendisse Rd.</direccion>
		<telefono>02 15 95 18 30</telefono>
		<codigo_postal>R6V 7R2</codigo_postal>
		<proximo_destino>Campania</proximo_destino>
		<pais>Poland</pais>
	</persona>
	<persona>
		<nombre>Cheryl Riggs</nombre>
		<email>nullam@google.com</email>
		<direccion>838-8844 Mus. Av.</direccion>
		<telefono>01 45 37 34 67</telefono>
		<codigo_postal>15837-95346</codigo_postal>
		<proximo_destino>Northwest Territories</proximo_destino>
		<pais>Sweden</pais>
	</persona>
	<persona>
		<nombre>Anthony Sandoval</nombre>
		<email>porttitor.interdum@icloud.net</email>
		<direccion>563-2654 Sodales St.</direccion>
		<telefono>05 20 39 43 56</telefono>
		<codigo_postal>847301</codigo_postal>
		<proximo_destino>Dōngběi</proximo_destino>
		<pais>Belgium</pais>
	</persona>
	<persona>
		<nombre>Allistair Wilkins</nombre>
		<email>consectetuer.rhoncus.nullam@aol.edu</email>
		<direccion>Ap #974-9452 Consectetuer Street</direccion>
		<telefono>08 13 72 49 74</telefono>
		<codigo_postal>264834</codigo_postal>
		<proximo_destino>Aquitaine</proximo_destino>
		<pais>Netherlands</pais>
	</persona>
	<persona>
		<nombre>Teegan Sims</nombre>
		<email>justo.proin@aol.edu</email>
		<direccion>Ap #499-6096 Vivamus Avenue</direccion>
		<telefono>07 57 26 95 25</telefono>
		<codigo_postal>38241</codigo_postal>
		<proximo_destino>Newfoundland and Labrador</proximo_destino>
		<pais>India</pais>
	</persona>
	<persona>
		<nombre>Rhiannon Atkins</nombre>
		<email>tellus@yahoo.couk</email>
		<direccion>964-4890 At Avenue</direccion>
		<telefono>09 93 71 41 86</telefono>
		<codigo_postal>95573</codigo_postal>
		<proximo_destino>Noord Holland</proximo_destino>
		<pais>Netherlands</pais>
	</persona>
	<persona>
		<nombre>Jacqueline Joyner</nombre>
		<email>non@yahoo.couk</email>
		<direccion>Ap #439-1841 Aliquet Rd.</direccion>
		<telefono>03 78 48 85 52</telefono>
		<codigo_postal>6265</codigo_postal>
		<proximo_destino>Bạc Liêu</proximo_destino>
		<pais>Spain</pais>
	</persona>
	<persona>
		<nombre>Savannah Strickland</nombre>
		<email>semper.dui@yahoo.couk</email>
		<direccion>490-5383 Mollis. Av.</direccion>
		<telefono>08 05 73 13 80</telefono>
		<codigo_postal>3976</codigo_postal>
		<proximo_destino>Dōngběi</proximo_destino>
		<pais>Canada</pais>
	</persona>
	<persona>
		<nombre>Basil Whitehead</nombre>
		<email>egestas.rhoncus@hotmail.ca</email>
		<direccion>P.O. Box 717, 7384 Nec Rd.</direccion>
		<telefono>02 13 47 65 46</telefono>
		<codigo_postal>3260</codigo_postal>
		<proximo_destino>Quebec</proximo_destino>
		<pais>Colombia</pais>
	</persona>
	<persona>
		<nombre>Garrison Rutledge</nombre>
		<email>tempor.lorem@outlook.couk</email>
		<direccion>4797 Velit St.</direccion>
		<telefono>02 44 56 49 09</telefono>
		<codigo_postal>220185</codigo_postal>
		<proximo_destino>Yukon</proximo_destino>
		<pais>Germany</pais>
	</persona>
	<persona>
		<nombre>Haley Collins</nombre>
		<email>pharetra.nibh@protonmail.edu</email>
		<direccion>407-7116 Dui. Rd.</direccion>
		<telefono>06 77 61 70 20</telefono>
		<codigo_postal>626755</codigo_postal>
		<proximo_destino>Huáběi</proximo_destino>
		<pais>United States</pais>
	</persona>
	<persona>
		<nombre>Burke Mclaughlin</nombre>
		<email>vivamus.rhoncus@protonmail.edu</email>
		<direccion>Ap #558-9548 Ac Street</direccion>
		<telefono>06 28 57 16 88</telefono>
		<codigo_postal>58597</codigo_postal>
		<proximo_destino>Arizona</proximo_destino>
		<pais>Peru</pais>
	</persona>
	<persona>
		<nombre>Evelyn Bean</nombre>
		<email>magna.nec.quam@yahoo.net</email>
		<direccion>601-8848 Ullamcorper. St.</direccion>
		<telefono>04 81 23 34 48</telefono>
		<codigo_postal>9773</codigo_postal>
		<proximo_destino>Sindh</proximo_destino>
		<pais>China</pais>
	</persona>
	<persona>
		<nombre>Penelope Marks</nombre>
		<email>parturient.montes@google.ca</email>
		<direccion>P.O. Box 156, 916 Scelerisque, Av.</direccion>
		<telefono>01 58 29 68 44</telefono>
		<codigo_postal>6629 QJ</codigo_postal>
		<proximo_destino>Alabama</proximo_destino>
		<pais>Costa Rica</pais>
	</persona>
	<persona>
		<nombre>Beatrice Owens</nombre>
		<email>neque.pellentesque@hotmail.org</email>
		<direccion>Ap #166-3751 Mauris Rd.</direccion>
		<telefono>07 27 74 17 28</telefono>
		<codigo_postal>68383-231</codigo_postal>
		<proximo_destino>Vorarlberg</proximo_destino>
		<pais>Turkey</pais>
	</persona>
	<persona>
		<nombre>Kaye Baker</nombre>
		<email>ultricies.adipiscing@hotmail.couk</email>
		<direccion>203-9015 A St.</direccion>
		<telefono>03 72 11 88 97</telefono>
		<codigo_postal>8015</codigo_postal>
		<proximo_destino>Paraíba</proximo_destino>
		<pais>Vietnam</pais>
	</persona>
	<persona>
		<nombre>James Ratliff</nombre>
		<email>et.ultrices.posuere@yahoo.ca</email>
		<direccion>P.O. Box 337, 7153 Aenean Rd.</direccion>
		<telefono>06 26 68 66 44</telefono>
		<codigo_postal>851852</codigo_postal>
		<proximo_destino>Vaupés</proximo_destino>
		<pais>Australia</pais>
	</persona>
	<persona>
		<nombre>Ahmed Wheeler</nombre>
		<email>vivamus@icloud.com</email>
		<direccion>8016 Pharetra. St.</direccion>
		<telefono>09 14 74 37 26</telefono>
		<codigo_postal>73-554</codigo_postal>
		<proximo_destino>Sonora</proximo_destino>
		<pais>Belgium</pais>
	</persona>
	<persona>
		<nombre>Edward Cohen</nombre>
		<email>morbi.metus@icloud.org</email>
		<direccion>592-4050 Non St.</direccion>
		<telefono>07 57 72 23 88</telefono>
		<codigo_postal>68339</codigo_postal>
		<proximo_destino>Connacht</proximo_destino>
		<pais>United Kingdom</pais>
	</persona>
	<persona>
		<nombre>Rhiannon Duncan</nombre>
		<email>proin@hotmail.org</email>
		<direccion>605-326 Enim. Rd.</direccion>
		<telefono>02 01 55 62 56</telefono>
		<codigo_postal>31275</codigo_postal>
		<proximo_destino>Katsina</proximo_destino>
		<pais>Chile</pais>
	</persona>
	<persona>
		<nombre>Renee Nielsen</nombre>
		<email>libero.proin@yahoo.couk</email>
		<direccion>683-9118 Quis Rd.</direccion>
		<telefono>08 77 21 91 43</telefono>
		<codigo_postal>826887</codigo_postal>
		<proximo_destino>Yukon</proximo_destino>
		<pais>Indonesia</pais>
	</persona>
	<persona>
		<nombre>Tana Callahan</nombre>
		<email>sed.pede@aol.edu</email>
		<direccion>Ap #857-4056 Ornare. Avenue</direccion>
		<telefono>09 49 85 19 30</telefono>
		<codigo_postal>17638</codigo_postal>
		<proximo_destino>Arunachal Pradesh</proximo_destino>
		<pais>United States</pais>
	</persona>
	<persona>
		<nombre>Evangeline Keith</nombre>
		<email>sollicitudin@hotmail.org</email>
		<direccion>Ap #846-9965 Pellentesque St.</direccion>
		<telefono>06 25 15 46 06</telefono>
		<codigo_postal>8063</codigo_postal>
		<proximo_destino>Bali</proximo_destino>
		<pais>Peru</pais>
	</persona>
	<persona>
		<nombre>Carlos Melendez</nombre>
		<email>mollis.integer@google.net</email>
		<direccion>213-6855 Interdum. Ave</direccion>
		<telefono>07 37 53 77 38</telefono>
		<codigo_postal>37815</codigo_postal>
		<proximo_destino>Rivers</proximo_destino>
		<pais>Germany</pais>
	</persona>
	<persona>
		<nombre>Hakeem Ball</nombre>
		<email>nibh.enim@google.edu</email>
		<direccion>Ap #626-6352 Sit Av.</direccion>
		<telefono>04 22 02 27 82</telefono>
		<codigo_postal>644260</codigo_postal>
		<proximo_destino>California</proximo_destino>
		<pais>Belgium</pais>
	</persona>
	<persona>
		<nombre>Tatiana Moss</nombre>
		<email>nisi.sem@google.couk</email>
		<direccion>419-2895 Elit, Avenue</direccion>
		<telefono>07 12 16 75 44</telefono>
		<codigo_postal>6212</codigo_postal>
		<proximo_destino>Vestland</proximo_destino>
		<pais>South Korea</pais>
	</persona>
	<persona>
		<nombre>Fuller Barton</nombre>
		<email>egestas.aliquam@protonmail.com</email>
		<direccion>Ap #267-4374 Erat. Road</direccion>
		<telefono>05 37 43 20 59</telefono>
		<codigo_postal>578557</codigo_postal>
		<proximo_destino>Araucanía</proximo_destino>
		<pais>Norway</pais>
	</persona>
	<persona>
		<nombre>Remedios Mccarthy</nombre>
		<email>mattis.ornare@yahoo.couk</email>
		<direccion>Ap #150-4725 Convallis Rd.</direccion>
		<telefono>07 47 44 61 46</telefono>
		<codigo_postal>7898 LJ</codigo_postal>
		<proximo_destino>South Sumatra</proximo_destino>
		<pais>Italy</pais>
	</persona>
	<persona>
		<nombre>Arthur Barnes</nombre>
		<email>vitae@google.org</email>
		<direccion>Ap #888-9684 Erat. St.</direccion>
		<telefono>02 65 48 72 26</telefono>
		<codigo_postal>16L 3R9</codigo_postal>
		<proximo_destino>Thừa Thiên–Huế</proximo_destino>
		<pais>France</pais>
	</persona>
	<persona>
		<nombre>Leilani Ayers</nombre>
		<email>ac@aol.ca</email>
		<direccion>441-5837 Facilisis Rd.</direccion>
		<telefono>03 72 55 21 47</telefono>
		<codigo_postal>11590</codigo_postal>
		<proximo_destino>Castilla - La Mancha</proximo_destino>
		<pais>Spain</pais>
	</persona>
	<persona>
		<nombre>Henry Solomon</nombre>
		<email>auctor.non@icloud.edu</email>
		<direccion>Ap #623-230 Gravida Rd.</direccion>
		<telefono>09 60 83 64 23</telefono>
		<codigo_postal>11228</codigo_postal>
		<proximo_destino>Riau</proximo_destino>
		<pais>Costa Rica</pais>
	</persona>
	<persona>
		<nombre>Alexa Dotson</nombre>
		<email>semper.erat@yahoo.couk</email>
		<direccion>Ap #262-5234 Mi. Avenue</direccion>
		<telefono>05 27 31 81 48</telefono>
		<codigo_postal>414757</codigo_postal>
		<proximo_destino>West-Vlaanderen</proximo_destino>
		<pais>Costa Rica</pais>
	</persona>
	<persona>
		<nombre>Bevis Frazier</nombre>
		<email>duis.cursus@outlook.com</email>
		<direccion>400-5965 Gravida Avenue</direccion>
		<telefono>02 36 53 97 71</telefono>
		<codigo_postal>20006</codigo_postal>
		<proximo_destino>La Libertad</proximo_destino>
		<pais>Australia</pais>
	</persona>
	<persona>
		<nombre>Tyrone Davis</nombre>
		<email>luctus.ipsum@outlook.edu</email>
		<direccion>631-5172 Curabitur Street</direccion>
		<telefono>09 89 47 61 78</telefono>
		<codigo_postal>7154 SW</codigo_postal>
		<proximo_destino>South Island</proximo_destino>
		<pais>Vietnam</pais>
	</persona>
	<persona>
		<nombre>Marshall Morris</nombre>
		<email>placerat.cras@hotmail.com</email>
		<direccion>948-625 Nisl. Ave</direccion>
		<telefono>03 02 45 88 61</telefono>
		<codigo_postal>838662</codigo_postal>
		<proximo_destino>Chihuahua</proximo_destino>
		<pais>Peru</pais>
	</persona>
	<persona>
		<nombre>Melanie Hensley</nombre>
		<email>pellentesque.a@yahoo.com</email>
		<direccion>5887 Non, Avenue</direccion>
		<telefono>08 64 92 86 21</telefono>
		<codigo_postal>PC0 2TM</codigo_postal>
		<proximo_destino>Luxemburg</proximo_destino>
		<pais>Belgium</pais>
	</persona>
	<persona>
		<nombre>Meredith Trujillo</nombre>
		<email>dui.fusce.aliquam@hotmail.com</email>
		<direccion>249 Eleifend. Av.</direccion>
		<telefono>05 88 28 85 95</telefono>
		<codigo_postal>8643</codigo_postal>
		<proximo_destino>Victoria</proximo_destino>
		<pais>Indonesia</pais>
	</persona>
	<persona>
		<nombre>Rylee Holman</nombre>
		<email>eu@hotmail.net</email>
		<direccion>P.O. Box 837, 5548 Tellus Rd.</direccion>
		<telefono>05 75 92 47 18</telefono>
		<codigo_postal>302258</codigo_postal>
		<proximo_destino>Salzburg</proximo_destino>
		<pais>Canada</pais>
	</persona>
	<persona>
		<nombre>Demetria Dunlap</nombre>
		<email>erat@icloud.couk</email>
		<direccion>179-5865 Iaculis Road</direccion>
		<telefono>05 62 04 96 76</telefono>
		<codigo_postal>3123</codigo_postal>
		<proximo_destino>Mexico City</proximo_destino>
		<pais>Costa Rica</pais>
	</persona>
	<persona>
		<nombre>Steven Allen</nombre>
		<email>enim@google.net</email>
		<direccion>4014 Ornare St.</direccion>
		<telefono>04 64 35 92 22</telefono>
		<codigo_postal>797697</codigo_postal>
		<proximo_destino>Pays de la Loire</proximo_destino>
		<pais>Colombia</pais>
	</persona>
	<persona>
		<nombre>Riley Marquez</nombre>
		<email>lacus.quisque.imperdiet@icloud.net</email>
		<direccion>Ap #698-4670 In Street</direccion>
		<telefono>03 45 91 46 85</telefono>
		<codigo_postal>544003</codigo_postal>
		<proximo_destino>Sachsen</proximo_destino>
		<pais>Nigeria</pais>
	</persona>
	<persona>
		<nombre>Mary Poole</nombre>
		<email>augue@protonmail.ca</email>
		<direccion>Ap #398-5695 Risus. Rd.</direccion>
		<telefono>04 67 41 57 19</telefono>
		<codigo_postal>48939</codigo_postal>
		<proximo_destino>Coquimbo</proximo_destino>
		<pais>Peru</pais>
	</persona>
	<persona>
		<nombre>Garth Gillespie</nombre>
		<email>et@yahoo.org</email>
		<direccion>Ap #722-6345 Mauris St.</direccion>
		<telefono>07 47 55 53 68</telefono>
		<codigo_postal>6353</codigo_postal>
		<proximo_destino>San José</proximo_destino>
		<pais>Colombia</pais>
	</persona>
	<persona>
		<nombre>Louis Rosario</nombre>
		<email>turpis.egestas@google.ca</email>
		<direccion>Ap #627-6450 Vestibulum Ave</direccion>
		<telefono>01 63 76 98 40</telefono>
		<codigo_postal>B3X 8K0</codigo_postal>
		<proximo_destino>Limón</proximo_destino>
		<pais>New Zealand</pais>
	</persona>
	<persona>
		<nombre>Seth Boyer</nombre>
		<email>rhoncus.id.mollis@yahoo.ca</email>
		<direccion>P.O. Box 220, 1757 Dolor. Rd.</direccion>
		<telefono>06 75 20 85 76</telefono>
		<codigo_postal>402397</codigo_postal>
		<proximo_destino>Daman and Diu</proximo_destino>
		<pais>Austria</pais>
	</persona>
	<persona>
		<nombre>Tobias Boyer</nombre>
		<email>ligula.donec@yahoo.ca</email>
		<direccion>865-5890 Dui Street</direccion>
		<telefono>02 12 67 57 37</telefono>
		<codigo_postal>644243</codigo_postal>
		<proximo_destino>Utrecht</proximo_destino>
		<pais>New Zealand</pais>
	</persona>
	<persona>
		<nombre>Drake Hill</nombre>
		<email>risus.in@aol.couk</email>
		<direccion>P.O. Box 782, 9159 Mauris. St.</direccion>
		<telefono>08 63 51 92 25</telefono>
		<codigo_postal>473085</codigo_postal>
		<proximo_destino>New South Wales</proximo_destino>
		<pais>France</pais>
	</persona>
	<persona>
		<nombre>Melvin Quinn</nombre>
		<email>quis@outlook.org</email>
		<direccion>Ap #680-7838 Rutrum Street</direccion>
		<telefono>01 87 79 57 71</telefono>
		<codigo_postal>767584</codigo_postal>
		<proximo_destino>Bahia</proximo_destino>
		<pais>Germany</pais>
	</persona>
	<persona>
		<nombre>Maxwell Dejesus</nombre>
		<email>in@icloud.com</email>
		<direccion>8380 A, St.</direccion>
		<telefono>03 92 00 23 88</telefono>
		<codigo_postal>185577</codigo_postal>
		<proximo_destino>Ceará</proximo_destino>
		<pais>Canada</pais>
	</persona>
	<persona>
		<nombre>Patience Bell</nombre>
		<email>odio.a@protonmail.edu</email>
		<direccion>526-1783 At, Ave</direccion>
		<telefono>09 32 34 34 23</telefono>
		<codigo_postal>41272</codigo_postal>
		<proximo_destino>Ancash</proximo_destino>
		<pais>Russian Federation</pais>
	</persona>
</listado>